{
  "schema_version": "crivo.implementation/1.0.0",
  "id": "crivo.sqlite.wal-concurrency-checker",
  "version": "0.1.0",
  "implements": "crivo.sqlite.wal.concurrency@0.1.0",
  "adapter": "builtin",
  "requires": [
    "sqlite3",
    "threads"
  ],
  "execution_policy": {
    "destructive": false,
    "isolation": "ephemeral",
    "network": "none"
  },
  "qualification": "qualified",
  "entrypoint": "crivo_sqlite_wal_concurrency_checker",
  "notes": "Executa leituras simultâneas multi-thread sobre banco de dados em modo WAL verificando ausência de bloqueios."
}
