{
  "schema_version": "crivo.implementation/1.0.0",
  "id": "crivo.registry.strict-validator",
  "version": "0.1.0",
  "implements": "crivo.catalog.schema-strict@0.1.0",
  "adapter": "builtin",
  "requires": [
    "crivo_core"
  ],
  "execution_policy": {
    "destructive": false,
    "isolation": "ephemeral",
    "network": "none"
  },
  "qualification": "qualified",
  "entrypoint": "crivo_registry_strict_validator",
  "notes": "Validador C++ estrito de schemas JSON e integridade referencial."
}
