{
  "schema_version": "crivo.implementation/1.0.0",
  "id": "crivo.security.header-hardening-checker",
  "version": "0.1.0",
  "implements": "crivo.security.header-hardening@0.1.0",
  "adapter": "builtin",
  "requires": [
    "boost_beast",
    "boost_asio"
  ],
  "execution_policy": {
    "destructive": false,
    "isolation": "ephemeral",
    "network": "loopback_only"
  },
  "qualification": "candidate",
  "entrypoint": "crivo_security_header_hardening_checker",
  "notes": "Inspeciona cabeçalhos CSP, X-Content-Type-Options e Cache-Control nas respostas HTTP locais."
}
